{"actions":{"gate_0_restored":true,"gate_2_through_6_locked":true,"network_capture_stopped":true,"pending_capture_abandoned":true,"pilot_disabled":true},"artifact_id":"7c33eefc8f6d2331553853dfe8e57c346d87cf64369008ee8c98c0f34c936ba9","artifact_is_command":false,"artifact_type":"Gate1RollbackReceipt","authority":false,"completed_at":"2026-08-05T04:20:00Z","contract_version":"eve_q_gate1_hardening_v0.1","created_at":"2026-08-05T04:20:00Z","from_gate":"LIVE_READ_ONLY_TELEMETRY_PILOT","human_promotion_required":true,"may_execute":false,"may_generate_live_proposal":false,"may_move_capital":false,"producer_commit":"1dda4089fd6f6c8eadc0550f65abaa2d7511303a","started_at":"2026-08-05T04:20:00Z","to_gate":"SIMULATION_ONLY","trigger":"operator_abort"}
